{
  "schemaVersion": "a2a-third-party-peer-evidence.v1",
  "version": "2.6.0",
  "commit": "8a44088",
  "generatedAt": "2026-06-28T07:38:13Z",
  "environment": {
    "os": "Windows",
    "python": "3.13.5",
    "ci": false
  },
  "gitSha": "8a44088",
  "gitDirty": true,
  "peer": {
    "name": "A2A Third-Party Demo Peer",
    "url": "http://127.0.0.1:49920",
    "endpoint": "http://127.0.0.1:49920/a2a/agents/third-party-demo-peer",
    "type": "third-party",
    "protocolVersion": "0.3.0"
  },
  "peerType": "third-party",
  "checks": {
    "agentCard": "PASS",
    "messageSend": "PASS",
    "messageStream": "PASS",
    "tasksGet": "PASS",
    "tasksCancel": "PASS",
    "tasksList": "PASS",
    "artifactChunks": "PASS",
    "sseFinalEvent": "PASS"
  },
  "status": "PASS",
  "steps": [
    {
      "name": "a2a.agent_card",
      "status": "pass",
      "detail": "name=A2A Third-Party Demo Peer protocol=0.3.0",
      "data": {
        "skills": 1,
        "endpoint": "http://127.0.0.1:49920/a2a/agents/third-party-demo-peer"
      }
    },
    {
      "name": "a2a.message_send",
      "status": "pass",
      "detail": "task=task_77b73ceb6a73cb17563c617f state=working",
      "data": {
        "taskId": "task_77b73ceb6a73cb17563c617f"
      }
    },
    {
      "name": "a2a.tasks_get",
      "status": "pass",
      "detail": "task=task_77b73ceb6a73cb17563c617f",
      "data": {
        "taskId": "task_77b73ceb6a73cb17563c617f"
      }
    },
    {
      "name": "a2a.message_stream",
      "status": "pass",
      "detail": "events=5 final=completed",
      "data": {
        "events": 5,
        "artifactUpdates": 2,
        "chunkIndices": [
          0,
          1
        ],
        "taskId": "task_5655be63c6df6e6a885de76b",
        "finalState": "completed"
      }
    },
    {
      "name": "a2a.artifact_chunks",
      "status": "pass",
      "detail": "chunks=2 indices=[0, 1]",
      "data": {
        "events": 5,
        "artifactUpdates": 2,
        "chunkIndices": [
          0,
          1
        ],
        "taskId": "task_5655be63c6df6e6a885de76b",
        "finalState": "completed"
      }
    },
    {
      "name": "a2a.sse_final_event",
      "status": "pass",
      "detail": "final=completed",
      "data": {
        "events": 5,
        "artifactUpdates": 2,
        "chunkIndices": [
          0,
          1
        ],
        "taskId": "task_5655be63c6df6e6a885de76b",
        "finalState": "completed"
      }
    },
    {
      "name": "a2a.tasks_list",
      "status": "pass",
      "detail": "2 tasks listed",
      "data": {
        "taskCount": 2,
        "taskId": "task_77b73ceb6a73cb17563c617f"
      }
    },
    {
      "name": "a2a.tasks_cancel",
      "status": "pass",
      "detail": "task=task_fec7e7fae147f5577f2a267f state=canceling",
      "data": {
        "taskId": "task_fec7e7fae147f5577f2a267f",
        "state": "canceling"
      }
    }
  ]
}
